{
  "id": "slider",
  "name": "Slider",
  "category": "form",
  "description": "An input where the user selects a value from within a given range. Supports single values and ranges",
  "props": [
    {
      "name": "defaultValue",
      "type": "number[]",
      "required": false,
      "defaultValue": [50],
      "description": "The default value(s) for the slider"
    },
    {
      "name": "value",
      "type": "number[]",
      "required": false,
      "description": "The controlled value(s) for the slider"
    },
    {
      "name": "onValueChange",
      "type": "function",
      "required": false,
      "description": "Callback fired when the slider value changes",
      "functionSignature": {
        "params": "value: number[]",
        "returnType": "void"
      }
    },
    {
      "name": "max",
      "type": "number",
      "required": false,
      "defaultValue": 100,
      "description": "The maximum value for the slider"
    },
    {
      "name": "min",
      "type": "number",
      "required": false,
      "defaultValue": 0,
      "description": "The minimum value for the slider"
    },
    {
      "name": "step",
      "type": "number",
      "required": false,
      "defaultValue": 1,
      "description": "The step value for the slider"
    },
    {
      "name": "disabled",
      "type": "boolean",
      "required": false,
      "defaultValue": false,
      "description": "Whether the slider is disabled"
    },
    {
      "name": "className",
      "type": "string",
      "required": false,
      "defaultValue": "",
      "description": "Additional CSS classes for styling"
    }
  ],
  "tags": ["slider", "range", "input", "form", "control"],
  "version": "1.0.0",
  "author": "UI Components Team"
} 