{
  "id": "textarea",
  "name": "Textarea",
  "category": "form",
  "description": "Displays a form textarea or a component that looks like a textarea. Used for multi-line text input",
  "props": [
    {
      "name": "label",
      "type": "string",
      "required": false,
      "description": "The label text for the textarea"
    },
    {
      "name": "placeholder",
      "type": "string",
      "required": false,
      "description": "Placeholder text shown when textarea is empty"
    },
    {
      "name": "value",
      "type": "string",
      "required": false,
      "description": "The controlled value of the textarea"
    },
    {
      "name": "onChange",
      "type": "function",
      "required": false,
      "description": "Called when the textarea value changes",
      "functionSignature": {
        "params": "event: React.ChangeEvent<HTMLTextAreaElement>",
        "returnType": "void"
      }
    },
    {
      "name": "disabled",
      "type": "boolean",
      "required": false,
      "defaultValue": false,
      "description": "Whether the textarea is disabled"
    },
    {
      "name": "rows",
      "type": "number",
      "required": false,
      "description": "The number of visible text lines"
    },
    {
      "name": "helperText",
      "type": "string",
      "required": false,
      "description": "Helper text displayed below the textarea"
    },
    {
      "name": "error",
      "type": "string",
      "required": false,
      "description": "Error message to display"
    },
    {
      "name": "className",
      "type": "string",
      "required": false,
      "defaultValue": "",
      "description": "Additional CSS classes for styling"
    }
  ],
  "tags": ["textarea", "input", "form", "multiline", "text"],
  "version": "1.0.0",
  "author": "UI Components Team"
} 