{
  "id": "data-table",
  "name": "DataTable", 
  "category": "data-display",
  "description": "Advanced data table component with sorting, filtering, pagination, and row selection",
  "props": [
    {
      "name": "columns",
      "type": "array",
      "required": true,
      "description": "Column definitions for the table using @tanstack/react-table format"
    },
    {
      "name": "data",
      "type": "array",
      "required": true,
      "description": "Array of data objects to display in the table"
    },
    {
      "name": "tableLabel",
      "type": "string",
      "required": true,
      "description": "Label for the table used in search placeholder and accessibility"
    },
    {
      "name": "filters",
      "type": "array",
      "required": false,
      "defaultValue": "[]",
      "description": "Array of filter configurations for faceted filtering. Each filter needs id and options array."
    },
    {
      "name": "createToolbarButtons",
      "type": "function",
      "required": false,
      "description": "Function that returns JSX for custom toolbar buttons. Receives (rowSelection, setRowSelection, hasSelected) params. Defaults to simple 'Add Item' button."
    },
    {
      "name": "onRowClick",
      "type": "function",
      "required": false,
      "description": "Optional callback when a row is clicked, receives row id"
    },
    {
      "name": "identifier",
      "type": "string",
      "required": false,
      "defaultValue": "name",
      "description": "Field name to use for main search/filter functionality"
    },
    {
      "name": "initialSorting",
      "type": "array",
      "required": false,
      "defaultValue": "[]",
      "description": "Initial sorting state for the table"
    }
  ],
  "tags": ["table", "data", "sorting", "filtering", "pagination", "selection"],
  "version": "1.0.0",
  "author": "UI Components Team",
  "dependencies": [
    "@tanstack/react-table",
    "@radix-ui/react-icons",
    "react-i18next"
  ]
} 