{
  "id": "progress",
  "name": "Progress",
  "category": "data-display",
  "description": "Displays an indicator showing the completion progress of a task, typically displayed as a progress bar",
  "props": [
    {
      "name": "value",
      "type": "number",
      "required": false,
      "defaultValue": 50,
      "description": "The progress value from 0 to 100"
    },
    {
      "name": "className",
      "type": "string",
      "required": false,
      "defaultValue": "",
      "description": "Additional CSS classes for styling"
    }
  ],
  "tags": ["progress", "loading", "indicator", "data-display"],
  "version": "1.0.0",
  "author": "UI Components Team"
} 