{
  "id": "input",
  "name": "Input",
  "category": "form",
  "description": "Form input component with validation states and labels",
  "props": [
    {
      "name": "type",
      "type": "enum",
      "required": false,
      "defaultValue": "text",
      "options": ["text", "email", "password", "number", "tel", "url"],
      "description": "Input type"
    },
    {
      "name": "placeholder",
      "type": "string",
      "required": false,
      "description": "Placeholder text"
    },
    {
      "name": "value",
      "type": "string",
      "required": false,
      "description": "Controlled value"
    },
    {
      "name": "defaultValue",
      "type": "string",
      "required": false,
      "description": "Default uncontrolled value"
    },
    {
      "name": "onChange",
      "type": "function",
      "required": false,
      "description": "Change handler function",
      "functionSignature": {
        "params": "event: React.ChangeEvent<HTMLInputElement>",
        "returnType": "void"
      }
    },
    {
      "name": "onFocus",
      "type": "function",
      "required": false,
      "description": "Focus handler function",
      "functionSignature": {
        "params": "event: React.FocusEvent<HTMLInputElement>",
        "returnType": "void"
      }
    },
    {
      "name": "onBlur",
      "type": "function",
      "required": false,
      "description": "Blur handler function",
      "functionSignature": {
        "params": "event: React.FocusEvent<HTMLInputElement>",
        "returnType": "void"
      }
    },
    {
      "name": "disabled",
      "type": "boolean",
      "required": false,
      "defaultValue": false,
      "description": "Whether the input is disabled"
    },
    {
      "name": "required",
      "type": "boolean",
      "required": false,
      "defaultValue": false,
      "description": "Whether the input is required"
    },
    {
      "name": "size",
      "type": "enum",
      "required": false,
      "defaultValue": "md",
      "options": ["sm", "md", "lg"],
      "description": "Input size"
    },
    {
      "name": "variant",
      "type": "enum",
      "required": false,
      "defaultValue": "default",
      "options": ["default", "error", "success"],
      "description": "Input variant/state"
    },
    {
      "name": "className",
      "type": "string",
      "required": false,
      "defaultValue": "",
      "description": "Additional CSS classes"
    },
    {
      "name": "label",
      "type": "string",
      "required": false,
      "description": "Input label"
    },
    {
      "name": "helperText",
      "type": "string",
      "required": false,
      "description": "Helper text below input"
    },
    {
      "name": "errorMessage",
      "type": "string",
      "required": false,
      "description": "Error message (overrides helperText)"
    }
  ],
  "tags": ["form", "input", "validation"],
  "version": "1.0.0",
  "author": "UI Components Team"
} 