{
  "id": "card",
  "name": "Card",
  "category": "layout",
  "description": "Flexible card component with header, body, and footer sections",
  "props": [
    {
      "name": "children",
      "type": "function",
      "required": true,
      "description": "Function that returns JSX for the card content.",
      "defaultValue": {
        "type": "function",
        "source": "return \"This is the card content.\";"
      },
      "functionSignature": {
        "params": "",
        "returnType": "React.ReactNode"
      }
    },
    {
      "name": "className",
      "type": "string",
      "required": false,
      "defaultValue": "",
      "description": "Additional CSS classes"
    },
    {
      "name": "padding",
      "type": "enum",
      "required": false,
      "defaultValue": "md",
      "options": ["none", "sm", "md", "lg"],
      "description": "Internal padding"
    },
    {
      "name": "shadow",
      "type": "enum",
      "required": false,
      "defaultValue": "md",
      "options": ["none", "sm", "md", "lg"],
      "description": "Drop shadow size"
    },
    {
      "name": "border",
      "type": "boolean",
      "required": false,
      "defaultValue": true,
      "description": "Whether to show border"
    },
    {
      "name": "rounded",
      "type": "enum",
      "required": false,
      "defaultValue": "md",
      "options": ["none", "sm", "md", "lg"],
      "description": "Border radius"
    },
    {
      "name": "header",
      "type": "function",
      "required": false,
      "description": "Function that returns JSX for the card header.",
      "functionSignature": {
        "params": "",
        "returnType": "React.ReactNode"
      }
    },
    {
      "name": "footer",
      "type": "function",
      "required": false,
      "description": "Function that returns JSX for the card footer.",
      "functionSignature": {
        "params": "",
        "returnType": "React.ReactNode"
      }
    }
  ],
  "tags": ["layout", "container", "card"],
  "version": "1.0.0",
  "author": "UI Components Team"
} 